Koshoki922,北京,棒棒哒，看了之后回头把漫威系列看差不多了,4.0,2015-05-13 23:10:33
StellaLou,,还行吧，一开始挺无聊的,3.0,2015-05-13 21:38:06
都市泡沫,,剧情混乱，看个热闹，特技不错,4.0,2015-05-13 20:37:51
_qq5zv1429793349,,还行吧！！！,4.0,2015-05-13 18:03:19
卡妙,,好看，没得说的好看,5.0,2015-05-13 17:46:58
可机智,,大晚上看这个简直心潮澎湃!!!太酷炫了!激动得根本停不下来!,4.5,2015-05-13 16:54:14
天青色等烟雨,金华,好看，大片就是大片，棒棒,5.0,2015-05-13 16:49:42
wly22,上海,别看情节看画面,4.0,2015-05-13 16:31:38
小土豆蜜思温,南京,黑寡妇红女巫都太帅了,4.5,2015-05-13 16:06:10
千色画魂,重庆,超好看，很喜欢,5.0,2015-05-13 14:43:10
八爷,上海,看了1就等2 什么时候能等到黑寡妇啊,5.0,2015-05-12 09:06:39
叫我大草莓啊,海口,超级好看！！！！！！！简直帅哭！,5.0,2015-05-12 04:02:19
家嘉,湛江,再接再厉， 待等3,5.0,2015-05-12 02:56:25
huazai7850,东营,美国队长打起了酱油,3.5,2015-05-12 01:17:51
tetsuhi,,漫威大法好好好！,4.0,2015-05-11 23:24:00
托尼-斯塔克,,漫威经典改编电影！,4.0,2015-05-11 20:40:03
宝贝记着,潍坊,超级粉丝！必须得去看！,5.0,2015-05-11 11:20:01
壮士不要,哈尔滨,美国大片的佼佼者,4.0,2015-05-11 10:44:21
奔向月亮的蜗牛,上海,为了看复联二特意翻出前传，却发现不过尔尔。影片充斥着大篇幅的口水战桥段。特别是钢铁侠和美队，鸡婆似的喋喋不休，令人厌烦。论情节，也永远逃不出漫威英雄片的一贯风格，毫无新意，看多了难免审美疲劳。一部票房超十亿美元的大片尚且如此，真后悔提前那么早就定好了第二部的票子。算了，权当去看看帅哥美女、观赏下特效吧。DN,3.0,2015-05-10 22:37:16
一只饕餮猫要开心,武汉,嘿嘿嘿…钢铁侠,4.0,2015-05-10 19:04:58
武抠抠,潍坊,挺好，英雄挺多，挺逗，挺嗨！,5.0,2015-05-10 17:30:06
hanbingjiaoyang,,补评一下，当年看得IMAX版的，确实好看。希望妇联二能再接再厉,4.0,2015-05-10 16:12:17
牟霜秋,,还行吧。漫威没必要这么激进，这么多漫威的系列干嘛非要揉在一起呢？,4.0,2015-05-10 11:16:03
小刚刚鱼儿,,妇联2即将大陆上映，《复仇者联盟》作为其前作，也是漫威电影宇宙的第六部影片，这之前我看了不下7、8遍。起初走进电影院不惜花高价钱买妇联3D票是感觉用一张电影票就能看到六个超级英雄的机会太难得，相当值了。作为漫威的忠实粉丝，电影中不需要有太跌宕起伏和夸张的剧情，超级英雄们劲爆的打斗戏和场面壮观的大爆炸足够让我为之疯狂，是的，韦登做到了，不得不说复仇者联盟的一切都显得臻于完美，渗透着激烈、幽默和惊喜，他把每个英雄角色在影片中都刻画得淋漓尽致，丝丝入扣，两个半小时的观影让我大喊过瘾，期待着每一部漫威佳作的到来！,5.0,2015-05-10 10:33:42
与璐同行,哈尔滨,超赞的电影，剧情紧凑,4.5,2015-05-10 07:04:11
刘北习403,佛山,很好看，看第二次l了,5.0,2015-05-06 08:42:56
dorothy,上海,蛮好看的，期待第二部,4.0,2015-05-06 00:33:36
xvX254512860,,期待已久了哈哈,5.0,2015-05-06 00:23:20
Tyki,太原,剧情很不错。,4.5,2015-05-05 15:30:49
蠟筆小新,,妇联Z，很好,5.0,2015-05-05 13:30:14
漂搏之人,杭州,这不是2012年放过的吗？,0.0,2015-05-05 10:46:51
liyifei124,深圳,这是复仇者联盟1啊！不是2！,0.5,2015-05-05 07:48:25
蝶意兰心,杭州,是不是很多人不知道这场不是第二部啊,5.0,2015-05-04 16:11:08
yYc15201278385,北京,还可以吧，没啥剧情,4.5,2015-05-04 14:03:04
小鸣鸣LOVE,句容,电影的剧情虽然没有漫画铺垫的全面…但是效果看起来就是带感…冯小刚又要嫉妒了,5.0,2015-05-04 13:54:57
jljljlj,,就为了演员整容就得给满分！当然剧情画面等等都超级棒。）,5.0,2015-05-03 21:48:12
桀骜537,,还可以吧，动作片已看过就忘,4.0,2015-05-03 18:41:06
hhafy,成都,漫威**粉一枚~妇联2下下周见！,4.5,2015-05-03 17:50:00
丫丫碎语,,无聊的时候看的，好吧，我是来看洛基的,3.5,2015-05-03 16:40:27
平起平坐OL,,超级牛逼哄哄的组合！怎么没见漫威的蜘蛛侠！？,4.0,2015-05-03 10:49:25
qianwumian,北京,经典漫威作品，赞,5.0,2015-04-25 12:02:28
_qqdw31423890254,,有精彩又搞笑，很好看,5.0,2015-04-24 22:36:49
auto,,太精彩了！可认为是2012年最棒的一部电影！,5.0,2015-04-24 22:02:24
浪味仙Fiona,,搞笑又刺激，满分,5.0,2015-04-24 21:40:12
朴四岁,,真真是极棒的!画面炫酷!真的期待第二部!,5.0,2015-04-24 18:23:18
s硕歌s,,这是电影的整合优化！,5.0,2015-04-24 08:31:33
延延,,＃北京电影节＃妇联2快上映了，再刷一边妇联1复习一下,5.0,2015-04-23 23:47:56
pokemongxs,兰州,很不错，期待2上映,5.0,2015-04-23 22:35:29
月经姨妈别样红z,万州,这是第一部还是第二部第一部我看过了,5.0,2015-04-23 13:52:43
meetyoumake,南昌,满分。没异议,5.0,2015-04-23 10:19:47
uNS468018246,,一定要看，好片子。,4.5,2015-04-23 06:50:34
Vigdis,济南,最爱的电影，没有之一。反反复复看了四五遍吧，但是最大的遗憾就是因为那年高考没有去影院看。可以想象到现场效果会有多棒！我对超级英雄有着特别的情感，不怕说出来好笑，我最大的梦想就是成为一个超级英雄，拯救世界。我做的梦在妇联里完完全全的实现了，他们有我想拥有的能力和态度。更何况是这么屌的六个人聚在一起！**无敌了！看起来完全不搭界的六个人因为要拯救世界而聚在一起，怎么看怎么觉得感动。习惯了一部电影一个超级英雄的我们，真的看到妇联感到太惊喜了。所以我一点不怀疑我同学给我说他们当时看完电影，全影院人起立鼓掌的盛况！,5.0,2015-04-19 23:32:34
gNG53186665,北京,致敬经典 支持北京国际电影节,5.0,2015-04-18 23:05:02
Xavi卷毛,,英雄集结超棒,5.0,2015-04-18 22:46:44
悦子LEE,北京,我是洛基的**粉，见到他就把他反派身份忘了好吗？每一次坏的动作都这么帅，这样真的好吗？让英雄们情可以堪，难怪雷神一直待你如初恋,4.5,2015-04-17 21:32:44
陈铁罐,,好想看！为何内地老是不爱同步！,4.5,2015-04-10 19:50:18
庚琳音乐之旅,,期待复仇者联盟2,5.0,2015-04-09 18:40:03
boliboli,,非常喜欢~~,5.0,2015-04-09 08:18:16
毛子MT,,满足一切期待,5.0,2015-04-09 06:58:23
向红,西安,很好看值得去看,4.5,2015-04-07 15:24:30
听海923314,天津,开始没什么感觉，后面很精彩，越看越投入,5.0,2015-04-05 21:45:32
Unique_hom,宁德,非常棒，当初是为了看《复仇者联盟》脑补漫威电影的，之后成了漫威影迷。看到浩克暴揍洛基那一段简直不能忍，最后托尼舍身送导弹直戳泪点，期待复仇者联盟2。,5.0,2015-04-03 00:20:14
KK灬Vin,太原,情节很棒，看这个之前还不是特别**的Marvel粉，看完这个就狂补美队1，无敌浩克和雷神1，之后就深深的爱上Marvel了！其实觉得Marvel应该先上妇联1，再上美队1和无敌浩克，因为这俩片都没在中国上映，也没有打开中国市场，先上妇联1吸引了人们，紧接着交代妇联英雄们的身世，肯定会有不小效益,5.0,2015-04-02 18:28:45
当波伏娃遇见萨特,,大爱妇联！！！,5.0,2015-03-31 17:36:45
自由飞翔5101112,佳木斯,很精彩的！值得看！,4.0,2015-03-23 20:06:02
jocogao,南京,太热闹了，期待第二部,5.0,2015-03-20 22:06:09
漫游星使,东方,很棒！非常喜欢看,5.0,2015-03-16 14:52:38
隔壁王叔叔,,我一个小伙伴想看第二遍的时候拉我去看的！不错！,4.0,2015-03-15 18:06:58
qXA9468785,广州,好看 厉害 好炫,5.0,2015-03-07 22:10:38
RQp900279021,,好好看呀！牛,5.0,2015-03-07 07:42:18
许小宝77,驻马店,超级好看，一星期最少来这里看一次电影。是这里的忠实粉丝啦！,5.0,2014-12-31 12:14:23
桔子和海,赣州,精彩，好好好好。,3.0,2014-12-30 20:44:10
Eyj25791771,太原,挺好看的，开心,4.0,2014-12-29 22:03:04
qfl70442254,汕头,还行，有点太假,4.0,2014-12-28 21:38:03
小舞0_0,深圳,这部是复仇者联盟2吗,5.0,2014-12-23 01:51:50
ett1027,上海,各类英雄在一起战斗，好看极了,5.0,2014-12-21 13:45:33
cailian1988,苏州,很好看，喜欢里面的巨人，可爱！,5.0,2014-12-20 17:12:12
樟梓,赣州,什么鬼买的是复仇者联盟   50一张  买了4张   开场居然是一步之遥   骗子欺骗消费者   花高价  看自己不想看的,0.0,2014-12-18 20:16:46
_qqm7d1334757510,杭州,很震撼，很好看,3.5,2014-12-16 09:40:41
kEd893076018,南通,烂片一部无聊,0.5,2014-11-17 13:33:37
Shen........,广州,上次看的！感觉还不错！与朋友一起来的,4.0,2014-11-16 15:45:20
nBy60081726小可,高密,经典大片，我的最爱！,5.0,2014-11-08 22:40:56
余福华,义乌,第一次看3D电影，视觉效果还是不错的。,4.5,2014-11-07 09:48:07
shaohaibo0927,苏州,视觉不错，喜欢科幻,5.0,2014-11-06 12:01:24
Leonardo多多多,,好看激情不解释,0.0,2014-10-09 15:07:47
ansonxcq,,很不错的一部片子,5,2012-06-23 20:24:57
恒雨泽,,无敌了，期待第二部！！,5,2012-06-23 00:28:35
牛魔王爷爷,,前面的一般，后面打外星人精彩！,0,2012-06-21 23:24:29
Olin,,大爱。。不错,0,2012-06-20 15:34:58
13995562625,,还没看的赶快去看，很值得一看，个人看的是3D-IMAX，感觉人都在电影里，很爽！特效和搞笑并存，SO good！,0,2012-06-17 02:07:11
天空City_12,,要不要抽个时间补看一下呢？,0,2012-06-15 15:06:45
yanwei_zhou,,非常精彩，期待续集,0,2012-06-15 14:57:00
风流无比,,很棒的电影，希望出续集,0,2012-06-15 10:40:44
18007713037,,我喜欢黑寡妇～♥,0,2012-06-15 02:09:13
左茶右烟,,前面剧情有些拖沓，后面还是蛮精彩的。,0,2012-06-15 00:07:15
_qq2hk1339210520,,前半段看不下去～后半段非常精彩，3d效果也很好～,0,2012-06-12 20:15:47
七纷晴天,,去影院看了两遍，汗，不过第二次看也照样给力。,0,2012-06-12 00:31:12
射干,,这样的片子只有米国人搞得出来。,0,2012-06-11 16:58:59
13927768609,,"假如中国神话英雄的联盟再结合一些科技细节,相信也会热闹,试想齐天大圣战超人,牛魔王斗绿巨人,或观音抗击外星人救凡间...",0,2012-06-10 18:45:01
铁任,,每一位都有充足的表演空间大展拳脚，两场大仗十几场小仗斗下来，每一仗都有宏大的场面和惊险的情景，飞舰大空战和最后保卫纽约的楼群大作战，从整体调度和视听风格来看，达到了当下好莱坞特效大片的最佳状态，影史最华丽一场行为艺术以优异的表现收场。,4,2012-05-06 12:31:00
张小北,,美国漫画英雄电影大乱炖之史上最强。,4,2012-05-06 10:22:00
楚沐风,,钢铁侠贱相十足，绿巨人既萌又暴力，鹰眼弓箭耍帅，黑寡妇大胸美艳，雷神负责雷人和被绿巨人虐，美国队长乃大妈杀手！反派洛基战斗力渣到呆萌。 笑点萌点看点均有，故事简约却不简单。前半部人物关系刻画得当，后半部群殴戏完美平衡。先打自己人，后打外星人。从头打到尾，全片无尿点！,4,2012-05-06 02:20:00
司馬追燕,,我知道，我就知道，斯塔克最后会躺进班纳的怀里，啊哈哈,4,2012-05-06 01:14:00
小海,,修正至4星。,4,2012-05-05 19:54:00
梦见乌鸦001,,钢铁侠继续吐槽帝，美国队长真屌丝，雷神高富帅而且来信砍，绿巨人已进化为萌系，三无娘黑寡妇与硬直男鹰眼眉来眼去，独眼弗瑞接着打酱油，小辣椒客串很给力，反派洛基风度偏偏最后变成天然呆。这帮人聚在一块，八个字：笑闹奇功，打个痛快！,5,2012-05-05 00:04:00
