清平乐cj,上海,漫威宇宙英雄大集结，这部里面有一共六位超级英雄，看来漫威是不折不扣准备继续在英雄大集结及个人英雄传记上走下去，而且越走越带劲，还带来了好多粉丝及爱好者，科幻特效大集结真的让人欲罢不能，这是第一部也称为第一阶段，看来这个头阵还是打的非常不错，两个彩蛋尤其是第一个还是预告了接下来的走向！,4.0,2018-02-01 14:56:12
蕻博,襄阳,炒鸡喜欢漫威英雄联盟系列。,4.0,2018-01-23 15:48:25
Pandora,青岛,完美，我喜欢钢铁侠的开始，对得起世界第五的位置了。,5.0,2018-01-14 15:45:48
JasonYu35,上海,堪称完美的超级英雄电影。剧情、角色、特效都十分棒。整场电影看下来没有一刻走神。影视历史上最棒的一部杰作!,5.0,2018-01-10 18:42:25
GLF200266607,达拉特旗,一次颠覆性的超级英雄电影，第一次看真的震撼到我了。,5.0,2017-07-22 16:18:36
大吃大悲,无锡,作为电影宇宙开拓的先锋，给个高分,4.0,2017-06-25 16:51:14
劉健濤,瑞昌,美队好像比以前弱了,5.0,2017-06-17 13:33:42
qzuser,荣成,红女巫胸不小啊,4.5,2017-06-15 20:47:20
danis4lllll,大连,高三的时候看的最好的电影！,5.0,2017-05-27 20:19:14
仅是歪理,天津,又一部看过就忘的漫威电影，只能说，场景还算震撼。故事嘛，嘿嘿嘿…,3.5,2017-05-20 16:57:13
开飞机的舒克,北京,很经典！不得不说,4.0,2017-05-09 09:56:15
DaweiLiu0813,济南,还不错，英雄差不多都全了,4.0,2017-04-19 01:08:03
Fearless听风,北京,在当时看完时候还是挺好看的,4.0,2017-04-18 00:23:24
Gilgamesh,北京,超燃，经典之作,5.0,2017-04-05 23:33:19
Ptb421927062,郑州,非常棒的一部英雄巨作！,4.5,2017-04-02 20:40:04
网名很俗,齐齐哈尔,很好看，复仇者集结,4.0,2017-04-01 22:00:05
大白白,呼和浩特,喜欢几个男人之间的情谊！,5.0,2017-02-24 23:37:04
iwannaseeeyou,上海,一开始黑乎乎，之后就很棒,4.5,2017-02-24 02:25:23
Yunyun,广州,漫威作品 必须好看,5.0,2017-02-14 22:53:59
HeavenSherlock,,成功地将之前搬上荧幕的超级英雄串联在一起  挺帅的,4.5,2016-07-18 17:13:55
境随心转_wj,,好看，最搞笑的是绿胖虐洛基，真的不喜欢洛基,4.0,2016-07-16 11:34:11
偶系高羊羊,天津,cool...,4.5,2016-07-11 21:59:18
有些遇见,济源,很好啊！非常不错。,4.5,2016-07-10 22:58:39
喵星来客,,还是第一部好看,4.0,2016-06-26 09:57:04
TKu225547568,杭州,前面部分烂后面好所已7分,3.5,2016-06-25 20:05:41
_qqw4k1404226757,,妇联、(●—●),5.0,2016-06-23 14:17:18
PRime.,,漫威入坑作，我刚开始接触这些英雄除了浩克，在电影就是关注钢铁侠，在海里的mark6从水面飞出就好激动，又认识雷神这些人物，复仇者集结在纽约一起阻止洛基，暴打暴爽，和《无敌浩克》一样看了两遍，在此之后就决定补了整个mcu和别家公司的漫威电影。,5.0,2016-06-21 12:41:28
不暴走的金克丝,绍兴,记得当时还蛮激动的 毕竟漫威死忠党,4.5,2016-06-13 14:23:46
lamzlp,庆阳,空中的航母，无敌的联盟！凸^-^凸,4.5,2016-06-10 23:54:15
步语轩觞,北京,挺精彩的，有一些笑点，蛮经典的,4.0,2016-06-10 21:14:17
大猫nancy,天津,漫威电影 风格依旧,5.0,2016-06-09 10:57:22
hujiajiu,,超能力大混战,4.5,2016-06-08 05:10:07
苏打频率,,复仇者联盟的起源，洛基被绿巨人打的好可怜啊。绿巨人的设定貌似有点bug，之前打黑寡妇六亲不认跟打狗一样，后面就组队一致对外了？还有就是洛基的洗脑大法也太弱了吧。,3.5,2016-06-08 01:04:51
张天师1123,,漫威大法好！,4.0,2016-06-03 00:43:20
leonie,北京,经典的漫威作品，延续一直的拯救世界的梗，但人物刻画，故事情节以及动作画面都很不错,4.5,2016-04-15 10:40:57
吃藕丑,,看了才发现看过,3.0,2016-04-14 17:31:44
墨羽小正太,泰州,第一部最经典,5.0,2016-04-13 20:17:20
Amber_你依然帅气,青岛,RDJ和抖森帅的啊   剧情好精彩,5.0,2016-04-09 11:30:59
snowskylover,太原,和兄弟一起在昌平看的，好看，绿巨人和雷神挺逗～,4.0,2016-04-09 11:06:59
zznhero,天津,第一次看很震撼,5.0,2016-04-09 10:42:15
Andy,,讨厌钢铁侠。讨厌所有人都分不出胜负,2.5,2016-04-06 10:14:51
小小子,上海,完美的电影。,5.0,2016-04-04 23:34:50
超级巴粉812,沈阳,比第二部好看,4.0,2016-04-04 09:46:41
时小缘,,妇联万岁！！！！！,5.0,2016-03-30 22:48:07
呢喃的海,,没什么说的，光看特效就够喜欢了,4.5,2016-03-29 11:44:01
pixie1215,福州,大乱斗好过瘾,4.5,2016-03-26 02:50:02
A喵zyx,,一般般，爆米花电影，剧情俗套，而且洛基boss也太弱了吧,3.0,2016-03-23 18:13:59
支支付付宝宝,漯河,演的有点杂  没单个好看  各自的电影都是经典,3.5,2016-03-22 08:43:07
风飘零,,燃，太燃了，绝对精彩，绝对好看，超级英雄片必看之作。。。,4.5,2016-03-20 23:46:48
寒窗阁,张掖,大爱队长，但说实话比不上第一部，非常讨厌黑寡妇的便装装扮丑爆了，尤其和绿巨人的感情戏太差了  大爱队长和铁人，,4.0,2016-02-02 17:58:40
威可,,作为“复仇者联盟”第一部以及漫威第一阶段收官之作，前半段大量的铺垫，交代各英雄的背景，至最后45分钟纽约大战极速进入高潮！六人背靠背一站，简直燃到不行！而且明显镜头运用变好！目不暇接之感！,4.0,2016-01-26 15:39:46
熙和如旧,杭州,一的成功是新鲜的超级英雄大杂烩和迷人的反派共同的结果，二就开始显出僧多粥少的弊端了显得剧情凌乱而且还拆鹰寡？所以看一觉得惊喜，二就审美疲劳了。,4.0,2016-01-20 00:04:12
熊大爱小堂,,跟精彩的一部电影，原因也很简单！美国英雄聚齐了哈哈哈钢铁侠，美国队长黑寡妇，绿巨人雷神和鹰眼侠在神盾局局长领导下联手除恶霸，夺回宇宙魔方……依旧大场面！不错的电影，值得一看！,4.5,2016-01-19 23:16:15
Aurora,郑州,完美！大爱寡姐！看得我直起鸡皮疙瘩,5.0,2016-01-18 12:26:26
Gta792459902,台州,老棒了 还是原来的味道,5.0,2016-01-15 19:10:47
Niu829196442,,挺好，值得一看,4.0,2016-01-12 10:52:57
唯夜丶忻恋,慈溪,非常棒的一部电影…个人非常喜欢,5.0,2016-01-12 10:27:42
Caizehao,东莞,喜欢漫威，3D体验也很好！,4.5,2016-01-09 17:38:43
阿阿阿棠,诸暨,身处神奇的宇宙 怎能不做个英雄,5.0,2016-01-07 21:52:06
xiqilizhang,温州,我的第一部漫威电影，看了这部，从此就迷上了漫威英雄！好看的一塌糊涂！,4.5,2015-12-29 22:52:44
幸运的派大星,成都,期待了很久，然而剧情只能说一般般吧，爆米花电影,4.0,2015-12-29 19:42:21
贝儿丫头,,美国大片部部不能错过！！嘿黑,4.0,2015-12-29 15:50:04
Future488,,简直不能更好看，期待3,5.0,2015-12-26 15:08:06
小小冯与老冯,朝阳,有一种热血沸腾的感觉，真的好想加入他们去拯救我们的世界和地球,4.0,2015-12-26 09:26:45
尼克PSP,九江,这是一部相当精彩的漫威电影！很喜欢这部电影，也综合了许多电影的主角！,4.5,2015-12-21 00:26:11
JuliaFanl,昆明,看了美国队长结尾的彩蛋，开始关注了复仇者联盟，作为科幻片的爱好者，当然不可以错过这个大片。这部片集攒了漫威电影中的各路英雄，只有了抓住一个叫洛基，洛基手里的武器是如此的厉害。雷神出现的时候一副保护地球的模样，帅呆了！鹰眼被迷幻了，但是多亏有了寡姐。本剧还是最喜欢美国队长。,4.5,2015-12-20 22:57:54
matrixneo123,南京,作为路人加影迷，我是一路见证漫威从单个电影到被迪斯尼收购到漫威宇宙终于在一部电影中正式融合统一的(派拉蒙时期的彩蛋姑且算单个电影之间的联系)但实际上为了讨好漫威的极客们本片的质量并不算好,3.0,2015-12-20 22:22:26
壊壊雨,大连,特效不用说了，很屌，不过也没什么剧情，就是打，但总归好于第二部，第二部都给我打睡着了！其实还是比较喜欢拍单个英雄的故事，像美国队长系列，蜘蛛侠系列。,3.5,2015-12-20 18:31:32
南宁吴彦祖,南宁,英雄电影，必看。第一次电影院看，第二次在宿舍跟同学一起看。虽然看过，但还是很喜欢，超级喜欢绿巨人。,4.0,2015-12-20 18:18:36
小鄧先生,南宁,剧情较为普通，但特效极棒，漫威英雄大集合比他们单打独斗更刺激，画面感超强，带入感更强，很不错的一部漫威电影,3.5,2015-12-20 17:43:49
菲奥娜,邯郸,那一年带给我无限惊喜，各种角色各种性格各种能力爆棚，整部影片贯穿始终一气呵成，打斗场面有多赞就不需要我说了，这绝对不是爆米花电影。大爱抖森。,4.0,2015-12-20 17:14:48
楼闹闹,东阳,个人感觉比之前几部超级英雄片子都好看，角色各个出彩，台词情节都很很不错。美队的出现让我热血沸腾，非常娱乐的大片，推荐大家观看！,3.5,2015-12-20 16:16:22
Alex,珠海,《复仇者联盟》并不只是靠笑点和内涵撑场面的，漫威这部强悍的作品主打的就是画面的华丽，打斗的精彩，3D效果确实震撼！各个大小的打斗场面，无一不追求细节，小场面如雷神战绿巨人，黑寡妇与鹰眼拳脚相加，雷神美国队长钢铁侠打群架，都是全剧的亮点，追求打斗细节，更为细腻。至于大场面，全剧最后复仇者团结一起，大战外星人的场面，更是看的场下的观众热血沸腾，也让人迷上了抖森。一般来说，大片的效果也就是大场面让观众过过瘾，《复仇者联盟》不止大场面，更多是在对剧情，对人物的触动。看着众英雄齐聚一堂到矛盾激化各自为战，再到最后团结在一起，共抗外敌，该片个人认为是漫威旗下最精彩的作品，没有之一。 评分 9.8,4.5,2015-12-20 15:38:51
大Cc_,顺德,一众超级英雄第一次召集，剧情都是维护世界和平没什么变化，倒是叙事比较清晰紧凑，视觉效果很不错，还不时有点笑料，而且人物众多不过都刻画得还算出彩，绿胖好萌，美队很帅，逗逼洛基已经成了重度中二病患者，每次看到其他几个一起看着洛基那么就是那么搞笑。,4.5,2015-12-20 14:02:47
奥斯卡1983,沈阳,不得不说漫威这部电影确实非常的成功，我个人非常喜欢，希望可续集不断,5.0,2015-12-20 12:16:52
aaaa,武汉,**，好帅！好帅！真的好帅！超级喜欢超级好看！,5.0,2015-12-20 10:52:00
Tiu275844989,大连,打斗好看，剧情垃圾，美国队长，雷神被削成渣，黑寡妇跟绿巨人讨论不孕不育问题也是醉人,2.0,2015-12-20 10:07:40
北落离商,十堰,棒棒的片子，还想再看一遍,4.5,2015-12-20 08:52:51
恬恬我的宝贝猪,无锡,这部片子太高智商了，我愣是没有看懂，还有朋友去看2遍的！我表示有点理解不了！,3.5,2015-12-20 07:36:21
晴天八戒,深圳,因为妇联把所有相关的漫威电影都看了，还是喜欢妇联1，第二部走马观花反倒没了意思。,5.0,2015-12-17 19:46:38
孙逸祖,深圳,男主角太霸气了,5.0,2015-12-17 18:08:05
墨矽,邯郸,感觉漫威的电影风格越来越好了，特效音乐还是情节。喜欢groot哦,4.5,2015-12-17 16:40:10
AilsaHan,北京,身为漫威电影粉怎么能不看呢！无论是动作戏还是偶尔逗比的对白都超中意！,4.5,2015-12-17 15:35:48
战狼,太原,个人英雄主义已不能拯救人类了，需要更多的英雄！所以有了英雄联盟！  所以人类得救了！  就这么简单！,5.0,2015-12-17 15:12:34
油菜叶叶,呼和浩特,漫威英雄必看,5.0,2015-12-17 15:03:55
张够花,成都,爆米花电影，特效没得说，剧情比较无聊，一眼看得到结束的电影。,3.0,2015-12-17 14:21:01
鲑鱼爱吃鱼,广汉,妇联开山作，漫威大电影逐渐发威。整体制作挺好，选角也合适。,4.0,2015-12-17 13:18:55
隔壁的泰3,郑州,场面火爆，特效逼真。能把这么多不电影串联到一部电影里也是牛逼了。,5.0,2015-12-17 13:09:31
MUg565810756,中山,没有办法，本人就是喜欢米国大片，就算没有剧情，我也喜欢电影的特效,3.5,2015-12-17 12:56:15
醉酒微微酣,上虞,英雄大联盟，也是一锅大杂烩。感觉剧情生硬，不是很响喜欢。不过曼威的号召力还是让票房大卖,3.0,2015-12-17 12:40:53
Gavin,自贡,老美的一锅杂烩,4.0,2015-12-17 12:18:03
蓝骨和尚,北京,漫威宇宙已然形成，各路人马齐聚一堂，讲了一个一群小孩过家家的故事，完全不顾观众智商。,3.5,2015-12-17 11:13:13
lyj245506073,南通,这部电影我追了很多了 这部依旧好看 简直就是一场视觉的盛宴了,5.0,2015-12-17 11:03:33
headinghy,西安,还是看了两遍的，看了，美国队长，绿巨人，钢铁侠，雷神，最后居然合起来拍了复联。不得不说漫威的想象力还是牛。,4.0,2015-12-17 10:59:37
Jason,赣州,这么多明星出演剧情戏份节奏都把握的这么好，实属难得。,5.0,2015-12-16 16:10:30
找本王何事,鞍山,超级好看，还幽默，大爱美队帅爆了。第二部照比第一步差多了,4.5,2015-12-16 15:11:05
Cynthia嘟嘟,南京,外国大片就是不一样，竟然把众多英雄集聚一堂，真的太精彩了，圆了很多粉丝的梦！,5.0,2015-12-16 14:53:04
雪莱475,北京,好莱坞从来都是夺人眼球，英雄大集结，打出一片天。看的过瘾,3.0,2015-12-16 14:46:35
我比我快,秦皇岛,个人认为漫威最火的电影了，里面的人物超多，期待第三部！,5.0,2015-12-16 14:26:00
uNh893649895,太原,动作片，大制作，那么多帅哥，为什么不呢？,4.0,2015-12-16 14:24:41
张xiaoxi77,杭州,好看、每一部大片都这么激动,5.0,2015-12-16 14:22:10
蓝眼小白兔,沈阳,复仇者联盟，这么多英雄在一起，真的很酷，蜘蛛侠哪去了,4.5,2015-12-16 14:03:53
gang,上海,摸爬滚打大大杂烩！好看！,4.0,2015-12-16 14:01:46
cuidi1103,武汉,不是漫威迷，但是就是喜欢美国大片的震撼，这部电影让人很失望，特效剧情动作都没有精彩点，片长过长，爆米花催眠电影。,3.0,2015-12-16 13:45:00
浪子G,上海,集结了这么多大牌，动作场面很劲爆，情节也很好看、期待还有续集,5.0,2015-12-16 13:28:33
曾小珂,绵阳,漫威大法好！汤包好！斯嘉丽好！寡姐好！剧情特效都是很好的！赞！❤️,5.0,2015-12-16 13:09:31
一米身高两米腿,郑州,妇联，看脸看特效。 漫威宇宙铺垫的不错，也期待DC的正义联盟。,4.0,2015-12-16 12:46:58
purple_shadow,北京,复仇者联盟作为漫威宇宙第一阶段的收官之作，绝对是良心作品，承接之前五部超级预告片的内容，把超级英雄们都集合在一起。这步棋下的即惊现又惊艳。对于之前五部超级预告片的内容很好的整合在一部电影中，即很好的突出主题，又把每个角色的特点表现的很到位，给漫威接下来的电影系列打下了良好的基础,4.5,2015-12-15 11:38:37
你来猜猜我是谁,北京,没说的，所有人都来了～关键是斯嘉丽约翰逊～,4.5,2015-12-15 01:03:55
好吃你也少吃点,济南,从头爽到位 能把各有特色的超级英雄们结合到一起又能展现各自个性,5.0,2015-11-17 14:04:41
Chums111,杭州,ok 很好看,5.0,2015-11-17 08:45:22
smQ165478309,沈阳,反正不好看，不喜欢,3.0,2015-11-16 11:16:56
金钱龟,北京,再不复见此圣景,5.0,2015-11-14 18:51:36
裤裆凉飕飕,湖州,经典，神一般的剧情神一般的特效,5.0,2015-11-14 10:50:28
提斯公子,北京,超级英雄合体 完美,5.0,2015-11-12 14:34:03
方人胥,,很棒！人物剧情都处理的很好,4.5,2015-11-11 14:13:30
淡淡的胡渣,,一部几乎完美的爆米花电影，谁在乎它演的是什么，因为它的幽默感太强大了！性格分明的人物，魅力十足的明星，层出不穷的笑料，紧张刺激的节奏，震撼视听的特效和层次分明的剧情编排，每一个超级英雄都有自己的性格和故事，他们都忙着互损互斗还一起欺负软妹，为什么这群演员都这么有爱呢？,4.0,2015-11-10 12:13:46
Jungle浅森,,入坑电影(๑•̀ㅂ•́)و✧从此变成漫威**粉,4.5,2015-11-09 23:32:12
glory930714,,第一部很不错,5.0,2015-11-09 13:30:41
lanxiangke,重庆,一入漫威深似海，从此DC是路人。,5.0,2015-11-09 10:46:33
騎豬去旅行,,**啊～至少和我的期望相差太大了，差评,2.0,2015-11-07 09:42:25
伪善宁,东阳,黑寡妇感情看不懂,5.0,2015-11-06 21:29:29
morefuck,,流水线作品，特效吊炸天,4.0,2015-11-06 11:00:01
夕玥筠兮,洛阳,很棒很精彩……,4.5,2015-11-05 16:35:38
安安1057,,比二好看，美队一如既往地帅。,4.0,2015-09-27 17:35:07
隐居的小幽,北碚,当然是除了完美没什么可说的啊,5.0,2015-09-27 00:11:51
Mr.Tequila,,总体还是不错的,4.5,2015-09-26 20:18:41
粒粒橙咩咩,南宁,超爱斯嘉丽和我robin阿姨！好好看！,4.5,2015-09-26 14:05:58
粉嘟嘟小寒,常州,动感大片，赞！,5.0,2015-09-25 16:27:10
咿呀炮,,八分都给特效,4.0,2015-09-25 00:58:02
咚咚,,第一部还是最好，洛基仔印象深刻，2要差了好多，奥创简直就没什么存在感。,4.5,2015-09-24 20:00:33
墩墩啊,,好看到不行不行的。,5.0,2015-09-20 00:09:08
lll1999man,,大感动作品，第一部集结了如此多的真人英雄电影，漫威饭必看之作。,4.5,2015-09-13 22:03:08
镸烟一空,,再看一遍，联系其它电影，细节上很用心。,4.5,2015-09-12 22:01:28
airong420,海口,好看的。啦啦啦,5.0,2015-09-11 23:00:46
Cristiano,,阵容真是太吸引人,4.5,2015-09-11 16:49:42
梨花先生丶,赣州,集齐这么多super hero确实看的很过瘾，还好寇森没死~,4.0,2015-09-11 12:37:08
KYJ952059551,深圳,还不错一直喜欢,5.0,2015-09-10 08:44:55
飞翔的雨滴,南京,很震撼，很好看,5.0,2015-09-08 08:28:00
yoursl11,,真他喵的帅~~~然而这剧情~~~这么弱的boss好像不需要这么多人来干他,4.0,2015-08-04 22:13:32
Elsa_,,超爱斯塔克。,4.5,2015-08-04 20:44:46
fkh953413122,,真是棒机了！,4.5,2015-08-04 09:22:02
TommyWu1993,珠海,这么多英雄，到底看谁啊？,3.5,2015-08-03 04:21:48
若曦尹233,,帅帅帅，就是锤哥能不二么？队长你的胸还能更大么？,5.0,2015-08-01 00:38:28
Sunshine-R,,能把几部大片的主角聚集在一起也是棒的。,5.0,2015-07-31 19:10:36
清清1213兮,湖州,v 很健康着,4.5,2015-07-30 23:45:06
风翔六界,合肥,就是看妮妮和美队的～洛基和雷神互动也很棒,4.0,2015-07-30 13:01:13
Thanos喵,莆田,就是英雄应该多一些,4.0,2015-07-30 01:17:59
琥珀之影,武汉,我只想说我看了两遍,5.0,2015-07-29 21:29:53
cookie4ever,北京,超级英雄我都喜欢,4.5,2015-07-28 13:31:45
Pitt,南京,钢铁侠很有潜力，但如果让我选择做其中一个，我还是会选hulk。天然呆啊，有木有。。。骑摩托车参战的场景你笑了吧；一人顶住一个飞船，你惊呆了吧；还有最后救钢铁侠的那一幕，感动到了吧。就是喜欢傻傻的野兽。,4.0,2015-07-18 21:30:08
chen-3-,珠海,怎么那么多外星龙 都好丑啊,3.5,2015-07-18 14:31:25
Benjamin_won.,西安,大哥！你能不能让尼克把眼罩摘下来啊！那样更炫酷好不好？！,5.0,2015-07-18 13:38:45
等一个晴天,,真好看，出三还来,5.0,2015-07-18 00:05:03
停在38楼2路电车,,喜欢那就没得说呀,4.5,2015-07-03 13:27:27
冬瓜芯,重庆,期待下一部。,4.5,2015-07-02 23:11:20
jiT674819563,深圳,总体还不错，感觉没有上一部好看！,4.5,2015-06-30 23:20:58
柠檬,,钢铁侠最后让人窒息。。,5.0,2015-06-29 03:13:37
Ollie大C,广州,电影真是差，没什么好看的。几个hero在哪里胡乱搞好，主线也不吸引人，差评,1.5,2015-06-28 16:54:47
cZf870736411,厦门,超级无敌赞，好看,5.0,2015-06-28 09:50:57
Andy_Tsao,昆山,漫威超级英雄集结号,4.5,2015-06-27 21:43:45
一元1204150165,乐清,还不错说可以吧,5.0,2015-06-27 21:21:50
OzP80137826,张掖,经常去看非常好。,5.0,2015-06-27 11:56:03
_qq3wz1429618501,,精彩！完美！,5.0,2015-06-26 12:37:55
婉清如,句容,感觉不是太精彩，没有1好看,3.0,2015-06-25 18:05:53
YVP15986601632,深圳,好激动的场面。,5.0,2015-06-25 09:53:06
孟娜丽莎的小黄人,,唯一遗憾的就是没有抖森！啊～,5.0,2015-06-24 23:35:21
天之骄子勾魂,,一般般！没啥特别的！没第一部好看,4.0,2015-06-24 06:48:14
TXm308124719,南充,没想想中好  还可以,5.0,2015-06-23 16:36:03
evf18605161980,徐州,影片火爆，演员酷毙，场面宏伟，,5.0,2015-06-14 13:50:03
羊蛮蛮,西宁,复仇者联盟     我是看不大懂     都睡着了,4.0,2015-06-14 08:49:36
zhuomenglu,合肥,感觉还挺好吧。,3.0,2015-06-14 07:21:45
Chris000000,重庆,与一无法相比 客服重重困难来看首映 结果睡着,4.0,2015-06-14 00:32:11
浅安浅笑,太原,不错，就是喜欢看动作片,5.0,2015-06-13 23:17:30
静姐女王,秦皇岛,很不错，就是热的困,5.0,2015-06-13 21:35:09
wytiger168,深圳,就是打得精彩，其他没啥,4.0,2015-06-13 18:39:37
慧慧在家88,南京,可以，不错，儿子喜欢。,4.5,2015-06-13 16:17:08
鱼日33,大连,不错的，典型的美国大片,4.5,2015-06-13 14:57:42
lyt243752055,乐清,当时买的时候还以为买错了，幸好放的时候是2,4.5,2015-06-13 12:13:10
GPE317083997,张掖,很好！！经常来这里看电影，希望座椅可以改进……,4.0,2015-06-13 11:49:42
dAB455411852,顺德,场面很精彩。,4.5,2015-06-13 11:43:00
Tyo792337022,南充,太一般了，老公都快睡着了,3.0,2015-06-13 07:26:06
双鱼儿果果,杭州,特效很不错，还想再看3,4.0,2015-06-12 15:19:56
两全,福州,真心不错，特效什么的都很棒，最喜欢钢铁侠，这部电影没有明显的硬伤，只是中间有些拖拉，给九分,4.5,2015-06-12 10:48:51
tdmkzdp,滕州,场景壮观，音效震撼,5.0,2015-06-02 07:49:41
hustyhd,宜昌,反派很强，有想象力，好看。场面火爆，剧情精彩，值得一看。,4.5,2015-06-01 19:00:06
我是你贝姐啊,哈尔滨,感觉没1好，不过还是棒棒哒,4.5,2015-06-01 14:05:55
侯布布,深圳,一群超级英雄追来追去,4.0,2015-05-31 22:09:10
CougarWomen,,这八分完全是因为有我雷神谢谢。,4.0,2015-05-31 16:11:16
Raywait,石家庄,已经看完复联2感觉还是1稍微好看一点，觉得2剧情有点扯淡。还是1好看，阵容依旧如此强大，正如看速度7不防把1-6重温。看复联2可以把1重温一下，你会觉得还是1好看。,5.0,2015-05-31 10:38:51
Ifz362151246,娄底,还可以，毕竟是美国大片，值得一看,5.0,2015-05-30 20:58:07
Cleovi,重庆,好看好看好看好看,4.0,2015-05-29 17:17:37
kwr504378105,赣州,值票价，推荐,5.0,2015-05-29 00:26:09
gncmc全家死光,常州,经典无法超越,5.0,2015-05-28 23:00:47
钻石会员,西安,其实特别想再看第二次，因为第一次看了一半睡着了！我就喜欢黑寡妇，支持下,3.5,2015-05-28 15:37:44
蔡爸爸630,乐清,挺好看的不错,4.5,2015-05-28 15:35:34
文13433570273,伊宁,好喜欢，是我喜欢的,5.0,2015-05-28 10:48:21
Nightlifewu,寿光,我爱capition,5.0,2015-05-28 09:17:32
未知者,南宁,能将每个人展示一遍之外塑造起人物性格，总的来说把握不错。除了精彩流程的特效场面和打斗动作，其实很大一部分成功是靠前期打下的基础，时不时来一句幽默的梗也很到位，导演风格很明显。洛基作为最佳反派，除了展示话唠的一面之外，还是挺突破的自我的。,4.0,2015-05-27 19:42:56
EwJ13799379957,,感觉一直打打杀杀，太热闹了。就那样吧。孩子说挺好的，他喜欢。,4.0,2015-05-17 22:28:45
苏景懿,徐州,一般吧，不如复联一,4.0,2015-05-17 20:35:10
_qq3md1430049601,,故事不错，战争场面不错，值得一看！,4.0,2015-05-17 19:20:22
XGy738455741,金华,无聊  看的要睡去了  这反派太垃圾了就会造小怪兽一点特点都没有,1.0,2015-05-17 14:45:55
封景禹城,,本来就喜欢漫威了，更喜欢把他们集结在一起的复仇者联盟！,5.0,2015-05-17 10:36:24
_qqv7h1431826929,,很不错了啊呀哈哈,5.0,2015-05-17 09:45:09
xiaoyiyihaha,沈阳,好看，好看，推荐推荐！！！,5.0,2015-05-17 07:04:37
愁容骑士小凯,张掖,虽然电影里不乏感人镜头，但感觉始终没有复仇者联盟各自队员自传更加感人应该是技术性的问题。有些字幕看不清，应该是光线的问题。,4.0,2015-05-17 00:54:56
鸭脖好好吃啊,合肥,绝对帅！啊亲啊啊啊,5.0,2015-05-16 23:59:38
JuliuCaesar,无锡,题材很好。 漫威大集合。 漫威迷的大圆满,3.5,2015-05-16 23:52:19
乔安娜Leo座,上海,一直都很喜欢看这种片子！自我感觉很好看,5.0,2015-05-16 21:49:43
运筹帷幄,,特效剧情都不错,4.0,2015-05-16 20:44:10
zRm610087533,晋城,刺激，过瘾，棒棒的,4.5,2015-05-16 18:57:48
_qqz4w1431767695,,也就那样吧,2.5,2015-05-16 17:20:43
wnnchans,苏州,比二好看多了,4.0,2015-05-16 15:09:46
阮皓kanye,绵阳,漫威的庞大宇宙很吸引人 各种英雄相互客串 每一阶段以一部复仇者联盟结尾 很棒,5.0,2015-05-14 18:26:52
sasuke8409,,比较新奇 开创系列,4.5,2015-05-14 13:16:37
小鹿姐姐,,太棒了！太好看了！,5.0,2015-05-14 12:55:40
Holiday945,,很好挺棒的！,4.5,2015-05-13 23:31:46
有梦就去追i,,特效！真3D,5.0,2015-05-13 23:25:06
